{
 "id": "class.paladin",
 "name": "Paladín",
 "coreTraits": {
  "Característica principal": "Fuerza y Carisma",
  "Dado de puntos de golpe": "1d10 por nivel de Paladín",
  "Competencias en tiradas de salvación": "Sabiduría y Carisma",
  "Competencias en habilidades": "Elige dos: Atletismo, Intimidación, Medicina, Perspicacia, Persuasión o Religión",
  "Competencias con armas": "Armas sencillas y marciales",
  "Entrenamiento con armaduras": "Armaduras ligeras, medias y pesadas y escudos",
  "Equipo inicial": "Elige A o B: (A) cota de malla, escudo, espada larga, 6 jabalinas, símbolo sagrado, paquete de sacerdote y 9 po, o (B) 150 po"
 },
 "progression": {
  "caption": "Rasgos de paladín",
  "header": [
   "Nivel",
   "Bonificador por competencia",
   "Rasgos de clase",
   "Canalizar Conjuros divinidadpreparados",
   "Espacios de conjuro por cada nivel de conjuro 12345"
  ],
  "rows": [
   [
    "1",
    "+2",
    "Imponer las manos, Lanzamiento de conjuros, Maestría con armas",
    "—2",
    "2————"
   ],
   [
    "2",
    "+2",
    "Castigo de paladín, Estilo de combate",
    "—3",
    "2————"
   ],
   [
    "3",
    "+2",
    "Canalizar divinidad, subclase de paladín",
    "24",
    "3————"
   ],
   [
    "4",
    "+2",
    "Mejora de característica",
    "25",
    "3————"
   ],
   [
    "5",
    "+3",
    "Ataque adicional, Corcel fiel",
    "26",
    "42———"
   ],
   [
    "6",
    "+3",
    "Aura de protección",
    "26",
    "42———"
   ],
   [
    "7",
    "+3",
    "Rasgo de subclase",
    "27",
    "43———"
   ],
   [
    "8",
    "+3",
    "Mejora de característica",
    "27",
    "43———"
   ],
   [
    "9",
    "+4",
    "Abjurar de los enemigos",
    "29",
    "432——"
   ],
   [
    "10",
    "+4",
    "Aura de coraje",
    "29",
    "432——"
   ],
   [
    "11",
    "+4",
    "Golpes radiantes",
    "310",
    "433——"
   ],
   [
    "12",
    "+4",
    "Mejora de característica",
    "310",
    "433——"
   ],
   [
    "13",
    "+5",
    "—",
    "311",
    "4331—"
   ],
   [
    "14",
    "+5",
    "Toque reparador",
    "311",
    "4331—"
   ],
   [
    "15",
    "+5",
    "Rasgo de subclase",
    "312",
    "4332—"
   ],
   [
    "16",
    "+5",
    "Mejora de característica",
    "312",
    "4332—"
   ],
   [
    "17",
    "+6",
    "—",
    "314",
    "43331"
   ],
   [
    "18",
    "+6",
    "Expansión de aura",
    "314",
    "43331"
   ],
   [
    "19",
    "+6",
    "Don épico",
    "315",
    "43332"
   ],
   [
    "20",
    "+6",
    "Rasgo de subclase",
    "315",
    "43332"
   ]
  ]
 },
 "features": [
  {
   "level": 1,
   "name": "Imponer las manos",
   "title": "Nivel 1: Imponer las manos",
   "subclass": null,
   "text": "Tu toque bendito puede curar heridas. Tienes una reserva de poder de curación que se rellena tras finalizar un descanso largo. Puedes recurrir a esta reserva para restaurar tantos puntos de golpe como cinco veces tu nivel de paladín.\n\nComo acción adicional, puedes tocar a una criatura (que puedes ser tú) y extraer energía de la reserva de curación para hacer que esa criatura recupere una cantidad de puntos de golpe, que como máximo será la cantidad que te quede en dicha reserva.\n\nTambién puedes gastar 5 puntos de golpe de la reserva para eliminar el estado de envenenada de la criatura, pero esos puntos gastados no restaurarán puntos de golpe.",
   "blocks": [
    {
     "type": "paragraph",
     "page": 82,
     "md": "Tu toque bendito puede curar heridas. Tienes una reserva de poder de curación que se rellena tras finalizar un descanso largo. Puedes recurrir a esta reserva para restaurar tantos puntos de golpe como cinco veces tu nivel de paladín.",
     "text": "Tu toque bendito puede curar heridas. Tienes una reserva de poder de curación que se rellena tras finalizar un descanso largo. Puedes recurrir a esta reserva para restaurar tantos puntos de golpe como cinco veces tu nivel de paladín."
    },
    {
     "type": "paragraph",
     "page": 82,
     "md": "Como acción adicional, puedes tocar a una criatura (que puedes ser tú) y extraer energía de la reserva de curación para hacer que esa criatura recupere una cantidad de puntos de golpe, que como máximo será la cantidad que te quede en dicha reserva.",
     "text": "Como acción adicional, puedes tocar a una criatura (que puedes ser tú) y extraer energía de la reserva de curación para hacer que esa criatura recupere una cantidad de puntos de golpe, que como máximo será la cantidad que te quede en dicha reserva."
    },
    {
     "type": "paragraph",
     "page": 82,
     "md": "También puedes gastar 5 puntos de golpe de la reserva para eliminar el estado de envenenada de la criatura, pero esos puntos gastados no restaurarán puntos de golpe.",
     "text": "También puedes gastar 5 puntos de golpe de la reserva para eliminar el estado de envenenada de la criatura, pero esos puntos gastados no restaurarán puntos de golpe."
    }
   ],
   "page": 82
  },
  {
   "level": 1,
   "name": "Lanzamiento de conjuros",
   "title": "Nivel 1: Lanzamiento de conjuros",
   "subclass": null,
   "text": "Has aprendido a lanzar conjuros gracias a la oración y la meditación. Consulta el capítulo “Conjuros” para ver las reglas sobre el lanzamiento de conjuros. La información presentada a continuación detalla cómo usar esas reglas con los conjuros de paladín, que encontrarás más adelante en la lista de conjuros de paladín de la descripción de la clase.\n\nEspacios de conjuro. La tabla “Rasgos de paladín” muestra cuántos espacios de conjuro tienes para lanzar tus conjuros de nivel 1 y superiores. Recuperas todos los espacios utilizados tras finalizar un descanso largo.\n\nConjuros preparados de nivel 1 y superiores. Preparas una serie de conjuros de nivel 1 y superiores, que son los que podrás lanzar con este rasgo. Para empezar, elige dos conjuros de paladín de nivel 1. Se recomiendan castigo abrasador y heroísmo. El número de conjuros de tu lista aumenta conforme subes de nivel de paladín, como se muestra en la columna “Conjuros preparados” de la tabla “Rasgos de paladín”. Cuando ese número aumente, elige conjuros de paladín adicionales hasta que el número de conjuros de tu lista coincida con el número de la tabla “Rasgos de paladín”. Estos conjuros deben ser de un nivel para el que tengas espacios de conjuro. Por ejemplo, si eres un paladín de nivel 5, podrías preparar cualquier combinación de seis conjuros de paladín de nivel 1 o 2. Si otro rasgo de paladín te proporciona conjuros que siempre tienes preparados, esos conjuros no cuentan para el total que puedes preparar con este\n\nrasgo, pero sí que cuentan como conjuros de paladín para ti.\n\nCambiar los conjuros preparados. Tras finalizar un descanso largo, puedes sustituir un conjuro de tu lista por otro conjuro de paladín para el que tengas espacios de conjuro.\n\nAptitud mágica. El Carisma es tu aptitud mágica en lo que respecta a tus conjuros de paladín.\n\nCanalizador mágico. Puedes utilizar un símbolo sagrado como canalizador mágico para tus conjuros de paladín.",
   "blocks": [
    {
     "type": "paragraph",
     "page": 82,
     "md": "Has aprendido a lanzar conjuros gracias a la oración y la meditación. Consulta el capítulo “Conjuros” para ver las reglas sobre el lanzamiento de conjuros. La información presentada a continuación detalla cómo usar esas reglas con los conjuros de paladín, que encontrarás más adelante en la lista de conjuros de paladín de la descripción de la clase.",
     "text": "Has aprendido a lanzar conjuros gracias a la oración y la meditación. Consulta el capítulo “Conjuros” para ver las reglas sobre el lanzamiento de conjuros. La información presentada a continuación detalla cómo usar esas reglas con los conjuros de paladín, que encontrarás más adelante en la lista de conjuros de paladín de la descripción de la clase."
    },
    {
     "type": "definition",
     "page": 82,
     "md": "***Espacios de conjuro.*** La tabla “Rasgos de paladín” muestra cuántos espacios de conjuro tienes para lanzar tus conjuros de nivel 1 y superiores. Recuperas todos los espacios utilizados tras finalizar un descanso largo.",
     "text": "Espacios de conjuro. La tabla “Rasgos de paladín” muestra cuántos espacios de conjuro tienes para lanzar tus conjuros de nivel 1 y superiores. Recuperas todos los espacios utilizados tras finalizar un descanso largo."
    },
    {
     "type": "definition",
     "page": 82,
     "md": "***Conjuros preparados de nivel 1 y superiores.*** Preparas una serie de conjuros de nivel 1 y superiores, que son los que podrás lanzar con este rasgo. Para empezar, elige dos conjuros de paladín de nivel 1. Se recomiendan *castigo abrasador* y *heroísmo*. El número de conjuros de tu lista aumenta conforme subes de nivel de paladín, como se muestra en la columna “Conjuros preparados” de la tabla “Rasgos de paladín”. Cuando ese número aumente, elige conjuros de paladín adicionales hasta que el número de conjuros de tu lista coincida con el número de la tabla “Rasgos de paladín”. Estos conjuros deben ser de un nivel para el que tengas espacios de conjuro. Por ejemplo, si eres un paladín de nivel 5, podrías preparar cualquier combinación de seis conjuros de paladín de nivel 1 o 2. Si otro rasgo de paladín te proporciona conjuros que siempre tienes preparados, esos conjuros no cuentan para el total que puedes preparar con este",